SQL> SELECT *
  2  FROM ALU0100844665.DEPARTAMENTO;

        CD D                                                                    
---------- ------------------------------------------------------------         
         1 ANALISIS MATEMATICO                                                  
         2 ASTROFISICA                                                          
         3 ESTADISTICA,INVESTIGACION OPERATIVA Y COMPUTACION                    
         4 MATEMATICA FUNDAMENTAL                                               

SQL> SELECT *
  2  FROM ALU0100844665.PROFESOR;
FROM ALU0100844665.PROFESOR
                   *
ERROR at line 2:
ORA-00942: table or view does not exist 


SQL> SELECT *
  2  FROM ALU0100844665.PROFESOR;
FROM ALU0100844665.PROFESOR
                   *
ERROR at line 2:
ORA-00942: table or view does not exist 


SQL> SELECT * FROM PROFESOR
  2  ;
SELECT * FROM PROFESOR
              *
ERROR at line 1:
ORA-00942: table or view does not exist 


SQL> SELECT *
  2  FROM ALU0100844665.PROFESOR;
FROM ALU0100844665.PROFESOR
                   *
ERROR at line 2:
ORA-00942: table or view does not exist 


SQL> INSERT INTO ALU0100844665.DEPARTAMENTO
  2  VALUES (5,'ECONOMIA');

1 row created.

SQL> UPDATE ALU0100844665.DEPARTAMENTO
  2  SET D='ECONOMIA APLICADA'
  3  WHERE CD=5;

1 row updated.

SQL> UPDATE ALU0100844665.TITULACION
  2  SET FAC='ETSII'
  3  WHERE T='GII';

1 row updated.

SQL> DELETE FROM ALU0100844665.TITULACION
  2  WHERE T='GII';
DELETE FROM ALU0100844665.TITULACION
                          *
ERROR at line 1:
ORA-01031: insufficient privileges 


SQL> ROLLBACK WORK;

Rollback complete.

SQL> CREATE VIEW AS
  2  SELECT A,CAR
  3  FROM ALU0100844665.ASIGNATURA;
CREATE VIEW AS
            *
ERROR at line 1:
ORA-00999: invalid view name 


SQL> CREATE VIEW VISTA3(A,CAR)
  2  AS (SELECT A,CAR
  3  FROM ALU0100844665.ASIGNATURA);

View created.

SQL> SELECT * FROM VISTA3;

A                                                         CAR                   
-------------------------------------------------- ----------                   
BASES DE DATOS                                              7                   
INTELIGENCIA ARTIFICIAL                                     4                   
ALMACENES DE DATOS                                          7                   
MINERIA DE DATOS                                            7                   
INFORMATICA BASICA                                          7                   
ALGEBRA                                                     1                   
OPTIMIZACION                                                6                   
GESTION DE RIESGOS                                          4                   
ASTRONOMIA                                                  3                   
ENSENANZA DE LA MATEMATICA                                  5                   
ANALISIS COMPLEJO                                           2                   

A                                                         CAR                   
-------------------------------------------------- ----------                   
CALCULO                                                     8                   

12 rows selected.

SQL> DROP VIEW VISTA3;

View dropped.

SQL> DROP TABLE ALU0100844665.ASIGNATURA;
DROP TABLE ALU0100844665.ASIGNATURA
                         *
ERROR at line 1:
ORA-01031: insufficient privileges 


SQL> DROP TABLE ASIGNATURA;
DROP TABLE ASIGNATURA
           *
ERROR at line 1:
ORA-00942: table or view does not exist 


SQL> CONNECT
Enter user-name: ALU0100844665
ERROR:
ORA-12162: TNS:net service name is incorrectly specified 


Warning: You are no longer connected to ORACLE.
SQL> CONNECT
Enter user-name: ALU0100844665
ERROR:
ORA-12162: TNS:net service name is incorrectly specified 


SQL> CONNECT
Enter user-name: alu0100844665
ERROR:
ORA-12162: TNS:net service name is incorrectly specified 


SQL> CONNECT
Enter user-name: alu0100844665
ERROR:
ORA-12162: TNS:net service name is incorrectly specified 


SQL> spool off
